{"findings":[{"claim":"A naive validity gate checking non-zero exit code of `cargo test` on base commit conflates compiler errors with test assertion failures.","evidence":[{"kind":"read-code","observation":"Alternative 4 specifies that tests must fail on the base commit without differentiating compile failure from test execution failure.","reference":".collab/consilium-2026-10-29-test-workers/handoffs/01-claude-cross-model-tests.md"},{"kind":"inferred","observation":"Rust cargo test exits non-zero (exit code 101) when compilation fails, meaning syntax errors and missing types pass a naive failure check.","reference":"cargo test exit behavior"}],"locations":[{"line":43,"path":".collab/consilium-2026-10-29-test-workers/handoffs/01-claude-cross-model-tests.md"}],"remedy":"Require a two-phase gate: compile test with `--no-run` against the new change first, and only consider a base run valid if compilation succeeds or failure is explicitly an assertion failure (`failures:` in output).","severity":"major","supersedes":[],"trigger":"A tester worker writes a test using newly introduced types or functions, or produces invalid syntax, and C3 runs `cargo test` against base commit.","verification":"Run `cargo test` on a test file referencing a nonexistent function on base commit and inspect exit code and stderr."},{"claim":"Path scoping to test files creates an irreconcilable dilemma between black-box integration tests and in-tree `#[cfg(test)]` modules.","evidence":[{"kind":"read-code","observation":"Lines 38-39 note that `#[cfg(test)]` modules live inside src files.","reference":".collab/consilium-2026-10-29-test-workers/handoffs/01-claude-cross-model-tests.md"},{"kind":"read-code","observation":"Work runs track file changes at the file path level via `git diff --stat` and `git status`, with no AST awareness.","reference":"crates/c3/src/work/mod.rs"}],"locations":[{"line":38,"path":".collab/consilium-2026-10-29-test-workers/handoffs/01-claude-cross-model-tests.md"}],"remedy":"Explicitly scope cross-model tester workers to integration tests under `tests/` in v1, leaving unit testing to the author model.","severity":"major","supersedes":[],"trigger":"Enforcing path scope to `tests/` prevents writing unit tests for private functions in `src/`, while allowing `src/` permits tester to modify author implementation.","verification":"Review the workspace tests: over 80% of unit tests in `c3` and `c3-core` are inline `#[cfg(test)]` modules inside `src/`."},{"claim":"Rapid sequential test worker runs on Windows risk target directory binary file-locking contention (OS error 5).","evidence":[{"kind":"read-code","observation":"Real GLM work run report records: 'failed to remove target\\debug\\c3.exe (os error 5) (a stale lock)' during rebuild.","reference":".collab/c3-work/work/01-ZAI-claude-glm-5.3/report.md"}],"locations":[{"line":29,"path":".collab/c3-work/work/01-ZAI-claude-glm-5.3/report.md"}],"remedy":"Add retry loops around target cleanup or use separate `--target-dir` scratch directories for tester validity checks.","severity":"minor","supersedes":[],"trigger":"Running an author worker followed immediately by a tester worker and validity gate checks on the same Windows host.","verification":"Execute two rapid sequential `cargo test -j 2` runs after binary modification on Windows and monitor for OS error 5."}],"first_run_checklist":[],"prior_findings":[],"reply_markdown":"## Framing and Unlisted Options\n\nThe brief frames the decision as choosing between manual convention or building an enforced author/tester pipeline into `c3 work`. This framing overlooks three critical options:\n\n1. **Option A: Adversarial Review Panel (`c3 consult --purpose test-oracle`)**: Instead of granting write tools to a second worker, run a read-only consultation. Reviewers inspect the author's diff and synthesize test cases or patches as structured findings. This avoids git/cargo lock races and respects strict sandbox boundaries.\n2. **Option B: Coordinator Skill Orchestration (`plugin/skills/coordinate`)**: Keep `c3 work` as an atomic worker execution engine. Let the Claude Code coordinator skill or an external script orchestrate sequential runs, branch switching, and scratch worktrees. C3 should not become a complex workflow scheduler.\n3. **Option C: Mutation and Property Testing (`cargo-mutants` / `proptest`)**: Two LLMs reading the same ambiguous prompt often share the same misconceptions. Verifying the author's tests via property-based testing or mutation analysis provides a genuinely independent oracle.\n\nTo choose between these, we need to know: (a) task distribution (novel features vs bug fixes/refactors), (b) baseline test failure modes in single-worker runs, and (c) Windows host capacity for sequential cargo builds without target-lock contention (`OS error 5`).\n\n## Numbered Questions\n\n### Q1. Value vs Convention\nNot worth building into C3 in v1. Keep it as coordinator convention (Alternative 1) with minimal metadata linkage. Building an enforced pipeline into the C3 binary prematurely freezes workflow semantics before empirical value is demonstrated.\n*Evidence to change answer*: (a) Data showing coordinators frequently fail to run testers manually, (b) 20+ benchmarked tasks showing cross-model testers catch severe defects missed by GLM and clippy, and (c) API compilation failure between author and tester is under 10%.\n\n### Q2. Blind vs Sighted Tester\n- **Sighted tester**: Catches implementation edge cases and unhandled boundary paths. Fails by overfitting to the author's code, asserting existing behavior rather than specified behavior.\n- **Blind tester**: Tests true specification requirements without implementation bias. However, in Rust, it fails catastrophically at compilation: without shared type signatures, method names, and error enums, the tester invents incompatible APIs that fail `cargo test --no-run`.\n- **Verdict**: Sighted catches more runnable bugs in Rust. Blind testing is only viable when the brief includes frozen, copy-pasteable Rust interface definitions.\n\n### Q3. Bug Arbitration and Auditing\n- **Arbitrator**: The human coordinator must arbitrate. LLMs cannot impartially resolve their own specification disputes.\n- **Auditable Record**: C3 must record `parent_run_id`, separate stdout/stderr streams for compilation vs assertion failures, exact diffs of both runs, and base-revert test exit codes.\n- **C3 Assistance**: C3 can run an automated revert check (run test on base commit) and classify failures into `CompilationError` vs `AssertionFailure`, presenting clean diagnostics without deciding blame.\n\n### Q4. Minimal C3 Surface\n- **Essential for v1**: Record linkage (`--parent-run <id>` in `run.json`) and advisory path scoping (`--path-scope \"tests/**\"` reporting warnings on violations).\n- **Gold-plating**: Automatic scratch worktrees, hardcoded role state machines, and automated arbitration gates.\n- **One live run**: Sequential execution (author completes before tester launches) preserves the \"one live run per task\" invariant naturally.\n- **`#[cfg(test)]` modules**: Path scoping cannot safely inspect AST boundaries inside `src/`. Restrict tester to `tests/**` (integration tests only) in v1.\n\n### Q5. Family-Diversity Rules\n- **Pairings**: GLM-5.3 (Zhipu/Claude engine) pairs effectively with DeepSeek-4.1-flash (BytePlus/Claude engine) or GPT-6.1-sol (OpenAI/Codex engine). Muse is undesirable due to its `--disable-sandbox` requirement on Windows.\n- **Enforcement**: Warn only. Hard refusal prevents offline development, single-subscription users, and tasks where fallback models are unavailable.\n\n### Q6. Unlisted Risks\n1. **Compilation Masking**: Naive validity gates treat compilation failure on base commit as test failure, allowing broken tests to pass the gate (finding #1).\n2. **`Cargo.toml` Pollution**: The tester adding dependencies, mutating lockfiles.\n3. **Windows File Locks**: Sequential cargo runs locking `target/debug/` binaries with OS error 5 (finding #3).\n4. **Mocking Trap**: Blind testers stubbing internal logic with dummy mocks, testing nothing of value.\n\n## Requested checks\n\n- **RC1**: Run `cargo test --test work -- --exact nonexistent_symbol` in `crates/c3-cli` (permission: read-only, budget: 60s). Observation that settles finding #1: confirms `cargo test` exit code when tests execute with 0 failures vs when compilation fails, validating whether C3 can differentiate validity gate outcomes without stderr parsing.","schema_version":"1","unproven":[],"verdict":"ADVISE","verdict_reason":"Keep cross-model testing as a coordinator convention with minimal metadata linkage in c3; do not hardwire pipeline enforcement or validity gates into the binary until empirical value and Rust compilation dynamics are proven."}