{"schema_version":"1","verdict":"HOLD","verdict_reason":"I am still reading the named fixes and have not finished the acceptance check.","reply_markdown":"Reading the handoff documents and the named fix sites before answering Q1–Q3.","findings":[],"prior_findings":[{"id":"F03-1","status":"not-checked","note":"Reading in progress."},{"id":"F03-2","status":"not-checked","note":"Reading in progress."},{"id":"F03-3","status":"not-checked","note":"Reading in progress."},{"id":"F03-4","status":"not-checked","note":"Reading in progress."},{"id":"F03-5","status":"not-checked","note":"Reading in progress."},{"id":"F03-6","status":"not-checked","note":"Reading in progress."},{"id":"F03-7","status":"not-checked","note":"Reading in progress."},{"id":"F03-8","status":"not-checked","note":"Reading in progress."},{"id":"F04-1","status":"not-checked","note":"Reading in progress."},{"id":"F04-2","status":"not-checked","note":"Reading in progress."},{"id":"F04-3","status":"not-checked","note":"Reading in progress."},{"id":"F04-4","status":"not-checked","note":"Reading in progress."},{"id":"F04-5","status":"not-checked","note":"Reading in progress."},{"id":"F04-6","status":"not-checked","note":"Reading in progress."},{"id":"F04-7","status":"not-checked","note":"Reading in progress."},{"id":"F05-1","status":"not-checked","note":"Reading in progress."},{"id":"F05-2","status":"not-checked","note":"Reading in progress."},{"id":"F05-3","status":"not-checked","note":"Reading in progress."},{"id":"F05-4","status":"not-checked","note":"Reading in progress."},{"id":"F05-5","status":"not-checked","note":"Reading in progress."},{"id":"F05-6","status":"not-checked","note":"Reading in progress."},{"id":"F05-7","status":"not-checked","note":"Reading in progress."},{"id":"F05-8","status":"not-checked","note":"Reading in progress."},{"id":"F05-9","status":"not-checked","note":"Reading in progress."},{"id":"F05-10","status":"not-checked","note":"Reading in progress."}],"unproven":["Full verification not started; this message is not the acceptance answer."],"first_run_checklist":[]}