{
  "schema_version": "1",
  "verdict": "ACCEPT",
  "verdict_reason": "F42-1 is fixed, the inspected recovery callers preserve inspection failures, and the saved targeted test results support acceptance of this delta without a new blocker.",
  "reply_markdown": "1. **Q1:** I found no remaining error-to-absence conversion in the recovery paths inspected. `read_pending_file` treats only `NotFound` as absence; other I/O failures and unusable contents refuse recovery. Consult, both panel entry checks, findings changes, listing, and kick propagate that refusal. Copy attribution retains unreadable task-named copies. The retained ledger-error conversion in `consult/recovery.rs` affects the recovered/cleared label, not process-liveness evidence. I did not independently audit all 91 retained hits.\n\n   **F42-1 is fixed.** The extended fixture asserts exit 1, the precise copy-read refusal, no engine-turn marker, a live helper, and retained evidence. The saved RC1 log records a pass. The two new unit tests also passed. The workspace log contains one embedding-test failure; its separate six-test rerun passed—this was not a clean single-pass workspace run.\n\n2. **Q2: ACCEPT for tagging v0.2.0**, carrying forward the previously documented release scope and compatibility limits. No new acceptance blockers found in `98a8742..05c4b9f`.\n\n   I read all changed production-code and test hunks, the 7d documentation and sweep inventory, relevant earlier-handoff excerpts, and targeted caller context. HEAD differs from the reviewed revision only in collaboration records. I did not read the bulk collaboration diffs, re-review the entire release, independently inspect every older fix, or rerun tests. Older findings without direct verification remain explicitly `not-checked`; acceptance does not certify them anew.\n\n   Before trusting the first real exit 0, observe the expected reviewer actually running, a usable persisted reply and matching ledger entry, and no unresolved recovery refusal. For recovery qualification, require inspection failures to prevent any engine turn, then require release only after the helper exits and the recovery copy is consumed.",
  "findings": [],
  "prior_findings": [
    {"id":"F02-1","status":"not-checked","note":"Telemetry spool implementation was outside this delta review."},
    {"id":"F02-3","status":"not-checked","note":"Deletion retry identity was not re-reviewed."},
    {"id":"F02-4","status":"not-checked","note":"The complete harness coverage map was not inspected."},
    {"id":"F02-5","status":"not-checked","note":"Rating transaction ordering was not rechecked."},
    {"id":"F02-6","status":"not-checked","note":"Prompt anchor implementation and fixtures were not inspected."},
    {"id":"F02-7","status":"not-checked","note":"Shared-plan configuration and cross-repository scheduling were not rechecked."},
    {"id":"F02-8","status":"not-checked","note":"The benchmark assumption was not tested; handoff 33 excludes native Messages from this release."},
    {"id":"F04-1","status":"not-checked","note":"Unicode process-name handling was not re-reviewed."},
    {"id":"F04-2","status":"not-checked","note":"Production Windows DST boundary behavior was not rechecked."},
    {"id":"F04-3","status":"not-checked","note":"Required-light ledger metadata was outside the inspected panel changes."},
    {"id":"F06-1","status":"not-checked","note":"Historical Samoa reset handling was not rechecked."},
    {"id":"F09-1","status":"not-checked","note":"Context-window configuration parsing was not re-reviewed."},
    {"id":"F09-2","status":"not-checked","note":"Flush/deletion synchronization was not rechecked."},
    {"id":"F09-3","status":"not-checked","note":"Recoverable deletion cleanup was not rechecked."},
    {"id":"F09-4","status":"not-checked","note":"Spool reread failure handling was not rechecked."},
    {"id":"F09-5","status":"not-checked","note":"Legacy-event sanitization was not rechecked."},
    {"id":"F09-6","status":"not-checked","note":"Bare-label rating actor inference was not rechecked."},
    {"id":"F11-1","status":"not-checked","note":"Health journal I/O failure handling was not rechecked."},
    {"id":"F11-2","status":"not-checked","note":"Required-reviewer launcher propagation was not rechecked."},
    {"id":"F11-3","status":"not-checked","note":"Shared-plan quota evaluation was not rechecked."},
    {"id":"F11-4","status":"not-checked","note":"PowerShell hook command execution was not rechecked."},
    {"id":"F11-5","status":"not-checked","note":"AGY tool stall allowance and attribution were not rechecked."},
    {"id":"F14-1","status":"not-checked","note":"Local-only deletion transaction persistence was not rechecked."},
    {"id":"F19-1","status":"not-checked","note":"Complaint/deletion synchronization was not rechecked."},
    {"id":"F19-2","status":"not-checked","note":"Unreadable-salt cleanup handling was not rechecked."},
    {"id":"F19-3","status":"not-checked","note":"Duplicate-key telemetry sanitization was not rechecked."},
    {"id":"F22-1","status":"not-checked","note":"Durable health journal deduplication was not rechecked."},
    {"id":"F23-1","status":"not-checked","note":"Process metadata lookup failures were outside this file-I/O review."},
    {"id":"F23-2","status":"not-checked","note":"Unknown process creation-time scans were not rechecked."},
    {"id":"F23-3","status":"not-checked","note":"Related pre-kill persistence code was inspected, but the original full crash schedule was not independently verified."},
    {"id":"F23-4","status":"not-checked","note":"The older deterministic process-inspection fixtures were not inspected."},
    {"id":"F23-5","status":"not-checked","note":"Production Windows Samoa tests were not inspected."},
    {"id":"F24-1","status":"not-checked","note":"Not-spooled lock-busy accounting was not rechecked."},
    {"id":"F24-2","status":"not-checked","note":"Unterminated not-spooled suffix handling was not rechecked."},
    {"id":"F24-3","status":"not-checked","note":"Concurrent not-spooled creation during cleanup was not rechecked."},
    {"id":"F24-4","status":"not-checked","note":"Latest unseen not-spooled event selection was not rechecked."},
    {"id":"F24-5","status":"not-checked","note":"P8 marker, production-layout, and cross-bridge concurrency coverage was not rechecked."},
    {"id":"F24-6","status":"not-checked","note":"Fold-record second-write failure handling was not rechecked."},
    {"id":"F25-2","status":"not-checked","note":"Endpoint transcript-location preflight was not rechecked."},
    {"id":"F25-3","status":"not-checked","note":"Claude model case normalization was not rechecked."},
    {"id":"F25-4","status":"not-checked","note":"Child-environment Debug redaction was not rechecked."},
    {"id":"F30-1","status":"not-checked","note":"Generic-helper ancestry and unreadable creation-time classification were not rechecked."},
    {"id":"F30-2","status":"not-checked","note":"The pre-kill writer was inspected, but all killer call sites and failure schedules were not re-reviewed."},
    {"id":"F30-3","status":"not-checked","note":"Continuation and repair durability fixtures were not individually inspected."},
    {"id":"F31-1","status":"not-checked","note":"Live-to-gone producer accounting was not rechecked."},
    {"id":"F36-1","status":"not-checked","note":"The documented Unicode path fix was read, but its implementation was not rechecked."},
    {"id":"F36-2","status":"not-checked","note":"The documented NFC guard fix was read, but its implementation was not rechecked."},
    {"id":"F38-1","status":"not-checked","note":"Related copy persistence and RC1 evidence were inspected; the complete no-record/no-kill implementation was not re-reviewed."},
    {"id":"F40-1","status":"fixed","note":"Directory-open and iteration errors propagate through PendingPaths and recovery refusal; the extended RC1 fixture exercises both modes and its saved log passes."},
    {"id":"F40-2","status":"fixed","note":"The kick caller reports the not-killed acknowledgement and returns 1; the saved workspace log records the dedicated RC2 integration test passing."},
    {"id":"F42-1","status":"fixed","note":"Only NotFound produces absence. Metadata/read errors produce an inspection refusal; caller checks and the passing extended RC1 fixture cover the reported trigger."}
  ],
  "unproven": [
    "The entire 4cd8d18..05c4b9f release and all older findings were not independently re-reviewed.",
    "Not every one of the sweep's 91 retained hits was independently traced.",
    "The metadata-denial integration case uses an injected error; real Windows ACL and sharing-failure behavior was not exercised during this consultation.",
    "No tests were executed during this read-only review; runtime conclusions rely on inspected fixture assertions and existing logs.",
    "Independent runtime injection coverage for panel member acceptance and findings mutation under inspection failures was not established."
  ],
  "first_run_checklist": [
    "Record the tested binary's version and build revision, and observe the intended reviewer, engine, and launcher in the run output.",
    "Observe a real engine turn and a usable persisted reply with a matching consultation ID and ledger entry; exit 0 alone is insufficient.",
    "With recovery-copy inspection denied, observe the path-specific refusal and nonzero exit, no new engine-turn marker, the helper still alive, and the evidence files retained.",
    "After restoring inspection, observe refusal while the helper lives; after it exits, observe recovery-copy consumption and a new engine turn.",
    "If an operator kick cannot persist kill evidence anywhere, observe 'not killed', the live root PID, and kick exit 1 rather than a stopped-success message."
  ]
}