{"findings":[{"claim":"close_event in telemetry/classes.rs hardcodes an event_type check for consultation and rating only, silently discarding any queued worker event.","evidence":[{"kind":"read-code","observation":"close_event returns None if event_type != \"consultation\" && event_type != \"rating\".","reference":"crates/c3/src/telemetry/classes.rs:870"}],"locations":[{"line":870,"path":"crates/c3/src/telemetry/classes.rs"}],"remedy":"Add \"worker\" to the recognized event_type list and implement a dedicated closed-vocabulary classifier for worker telemetry events.","severity":"major","supersedes":[],"trigger":"An event with event_type: \"worker\" is enqueued and processed by close_event_body during telemetry dispatch.","verification":"Pass a valid JSON object with event_type: \"worker\" to close_event_body; verify that None is returned."},{"claim":"validate_roster enforces a fail-closed allowlist of reviewer entry keys that rejects any effort or effort_policy property.","evidence":[{"kind":"read-code","observation":"iobj.keys() is strictly validated against an exact 14-string allowlist that does not include effort.","reference":"crates/c3-core/src/roster.rs:483"}],"locations":[{"line":483,"path":"crates/c3-core/src/roster.rs"}],"remedy":"Add \"effort\" to the allowed reviewer keys in validate_roster and define its schema parser.","severity":"minor","supersedes":[],"trigger":"A reviewer entry in codex-consult-roster.json includes an \"effort\" or \"effort_policy\" key as proposed in the sketch.","verification":"Invoke validate_roster with a roster containing an \"effort\" dictionary on an entry; verify that an unknown key refusal is emitted."},{"claim":"Caps-v1 capability table defines static vocabulary identifiers without supporting per-purpose effort policies or fallback mappings.","evidence":[{"kind":"read-code","observation":"Caps struct only exposes vocabulary, models, and schema_transport without purpose-to-tier mappings.","reference":"crates/c3-core/src/effort.rs:94"}],"locations":[{"line":94,"path":"crates/c3-core/src/effort.rs"}],"remedy":"Introduce purpose-aware effort resolution and fallback tables in c3_core::effort.","severity":"note","supersedes":[],"trigger":"Consultation orchestration attempts to resolve a per-purpose effort policy from caps-v1.","verification":"Inspect Caps definition in c3-core/src/effort.rs; verify absence of purpose-to-tier mappings."}],"first_run_checklist":[],"prior_findings":[],"reply_markdown":"## Framing Review: Measuring Reviewers and Workers\n\nThe brief assumes reviewer tiers can be scored under a common denominator and that scouts can reliably summarize diffs for judges. Both assumptions break under operational reality.\n\n### Framing Challenges & Unlisted Options\n1. **Asymmetric Currency Fallacy**: Astra is bottlenecked by a non-linear 5-hour rolling quota window under fixed subscription cost; GLM is bottlenecked by linear API credits without rolling limits. Dividing GLM by window share is undefined; dividing Astra by fiat cost yields zero marginal cost until abrupt 98% lockout.\n2. **The Summarization Blindspot**: Subtle bugs (e.g. F46–F62 timestamp precision and byte-slicing) look like ordinary code. A cheap scout compresses away the exact edge case, blinding the judge.\n3. **Unlisted Option: Deterministic AST Slicing**: Instead of prose digests, the scout produces structured slice manifests (call-chains, touched invariants, hunk boundaries).\n4. **Unlisted Option: Code-Survival Attribution**: Instead of subjective coordinator marks, measure worker quality by git hunk survival rate in the final merge.\n\n---\n\n### Q1. Effort Tiers and Scoring Denominator\n**Effort per purpose**:\n- **gpt-6-astra**: \n  - *Chore*: **Never route to Astra** (burns 10–23% window for trivial queries; route to GLM low or local grep). If forced: `low`.\n  - *Checkpoint*: `medium`.\n  - *Framing / Decision / Diff-review*: `high` (wave 8 proved `high` is necessary to detect subtle invariants).\n  - *Acceptance / Core-contract / Stuck*: `xhigh` (or `high` with strict reading discipline).\n- **glm-5.3**:\n  - *Chore*: `low`.\n  - *Checkpoint / Framing / Decision*: `high` (caps-v1 maps medium -> high).\n  - *Diff-review / Acceptance / Core-contract / Stuck*: `max` (GLM is cheap per token; reducing effort saves pennies while sacrificing defect discovery).\n\n**Denominator**:\nUse **Dual-Currency Cost per Verified Finding (CPF)**:\n- Astra: Verified Findings / (Δ 5h-window share % × congestion factor).\n- GLM: Verified Findings / Dollar spent.\nWall-time must act as an SLA timeout filter, not an efficiency denominator.\n\n**Unlisted Design**: **Two-Pass Escalation Ladder**. Run GLM at `low` (or Astra `medium`) first; escalate to Astra `high`/`xhigh` only if diff-review yields an unverified `ACCEPT` or ambiguous warnings.\n\n### Q2. Worker Telemetry & Attribution\n- **Capture Point**: `SubagentStop` is necessary but insufficient: it misses context thrashing, mid-flight stall loops, and unhandled crashes. It must pair with `SubagentStart` to track orphaned workers.\n- **Privacy Constraints**: Strictly exclude task slugs, prompt text, file paths, branch names, bash strings, diffs, and error logs. Emit only closed enums: `worker_tier`, `model_token`, `duration_bucket`, `tokens_bucket`, `outcome_class`, `edits_class`.\n- **Attribution on Rework**: Replace subjective `c3 workers rate` with **Git Hunk Survival Ratio**:\n  - *Clean*: ≥ 80% hunks survive in coordinator commit.\n  - *Assisted*: 20–79% hunks survive.\n  - *Discarded*: < 20% hunks survive (docking worker tier score).\n  Correlate with subsequent reviewer findings on touched hunks.\n\n### Q3. Closed Vocabulary Additions\nAdd immediately:\n1. `Event` (consultation): `effort_sent` (`none|low|medium|high|xhigh|max`), `effort_requested`, `quota_window_bucket` (`none|0-25|25-50|50-80|80-98|98-100`), `cache_ratio_bucket` (`0-25|25-50|50-75|75-100`).\n2. `RatingEvent`: `effort_sent` (enables rating analysis without joining).\n3. `WorkerEvent`: `worker_tier` (`haiku|sonnet|opus|fable|other`), `worker_model`, `effort` (`none|low|medium|high|xhigh|max|unknown`), `task_purpose` (`chore|fix|feature|test|refactor|other`), `outcome` (`completed|stopped_coordinator|failed:timeout|failed:quota|failed:context|failed:other`), `rework_class` (`none|minor|major|discarded`), `verification_status` (`clean|failed|unrun`).\n\n### Q4. Scout-and-Judge Routing\n- **Failure Modes**: (1) *Compression loss*: scout omits subtle edge cases. (2) *Confirmation bias*: judge audits the scout's narrative rather than raw code.\n- **Caps & Safeguards**:\n  - Scout emits **structured AST index/slice maps only**, capped at 1,500 tokens / 100 lines.\n  - **Judge Evidence Invariant**: Judge must read code via direct tool calls (`READING_DISCIPLINE`, max 200 lines/call); citing the digest as primary evidence fails validation.\n\n## Requested checks\n\n- **RC1**: Run `cargo test -p c3 telemetry::classes::tests::worker_event_dropped` from repo root (permission: read-only; budget: 30s) testing whether `close_event_body` drops `\"event_type\":\"worker\"` (finding #1). Settle when test confirms rejection.\n- **RC2**: Run `cargo test -p c3-core roster::tests::reject_effort_key` from repo root (permission: read-only; budget: 30s) validating a roster entry with an `\"effort\"` key fails `validate_roster` with \"unknown key 'effort'\" (finding #2). Settle when refusal message is confirmed.","schema_version":"1","unproven":[],"verdict":"ADVISE","verdict_reason":"Scoring must decouple subscription window congestion from API token costs, replace prose scout digests with structural slices, and validate worker telemetry through git survival metrics before publishing the closed schema."}