{
  "schema_version": "1",
  "verdict": "ACCEPT",
  "verdict_reason": "The two handoff-02 defects are closed in current HEAD e2046ed; this focused inspection found no release blocker, with concurrency behavior still requiring runtime verification.",
  "reply_markdown": "**Q1.** Both handoff-02 findings are closed by code inspection:\n\n- **Unreadable diff:** `staged_diff` returns `None` on subprocess failure (`crates/c3/src/finish/secret_gate.rs:219`); `scan_staged` converts that into an unreadable hit (`:99`), and `run_finish` refuses before committing (`crates/c3/src/finish/mod.rs:218`). An explicitly allowed path remains exempt by design.\n- **Added content beginning `++`:** `added_from_diff` tracks hunk boundaries and strips exactly one leading `+` inside a hunk (`secret_gate.rs:131`). Its regression fixture includes `++key`, checks the extracted content, and checks secret detection (`:306`). I read the test but did not execute it.\n\nThe brief names `1fe9c09`; current HEAD is **`e2046ed`**. I inspected the original fixes and relevant subsequent changes. Per your narrowed request, the remaining panel findings are not independently re-reviewed; their statuses below distinguish inspected code from unchecked scope.\n\n**Q2.** No new blocker identified. The staged-list refusal intentionally cannot be overridden; repairing Git makes it passable, and the error now explains that (`finish/mod.rs:107`). The final drift calculation now rehashes the brief and artifacts as well as the tree (`consult/orchestrate/mod.rs:4764`), closing F10-1 for changes remaining at the final snapshot. A write subsequently restored to identical bytes remains invisible to content snapshots.\n\nThe status lock cannot wait indefinitely: acquisition stops after ten seconds or an error (`consult/detach.rs:1317`). However, both callers continue without a lock when acquisition fails (`:1045`, `:1355`), so this is **not unconditional serialization**. F04-6 remains partially open for that fallback. The live-bridge guard and fresh-record check reduce the race exposure (`:1336`). I did not run a concurrent completion fixture.\n\n**Q3.** Neither decided boundary should block 0.2.4 under the coordinator's stated trust model. Claude drift remains a warning when its init is absent or read-only; unexpected tools remove that exemption (`consult/orchestrate/tree.rs:178`). The documented collab exclusions deliberately trade write attribution for avoiding parallel-run false failures (`.eck/TECH_DEBT.md:42`). These are operational boundaries, not proof that no reviewer or hook wrote files.\n\n**Blockers:** none identified in this focused pass. I did not read the complete panel, retention, worker-recording, engine, or detached-process implementations, nor all review artifacts. No builds or tests were run and no files were written.\n\n## Requested checks\n\n- **RC1 — workspace-write; repository root; budget 2 minutes:** In a disposable Git fixture, stage a secret-bearing line beginning `++`; verify finish refuses and HEAD remains unchanged. Then inject failure specifically into the per-file cached diff command; verify an unreadable-path refusal and unchanged HEAD. Restore normal Git behavior and clean content; verify finish succeeds.\n- **RC2 — workspace-write; repository root; budget 3 minutes:** Run a detached fixture while two status readers poll, holding the task lock beyond ten seconds during completion; verify the final status remains `done`, readers never record death while the bridge lives, and no terminal result is overwritten. This checks F04-6's unlocked fallback.",
  "findings": [],
  "prior_findings": [
    {"id":"F03-1","status":"fixed","note":"Inspected staged listing now includes T via ACMRT."},
    {"id":"F03-2","status":"fixed","note":"Listing failure produces an unreadable pseudo-hit and refuses."},
    {"id":"F03-3","status":"not-checked","note":"Outside the requested two-finding verification."},
    {"id":"F03-4","status":"not-checked","note":"Reviewed the accepted boundary documentation, not the complete filtering implementation."},
    {"id":"F03-5","status":"not-checked","note":"Retention implementation not independently reviewed."},
    {"id":"F03-6","status":"not-checked","note":"Worker object-write failure handling not independently reviewed."},
    {"id":"F03-7","status":"not-checked","note":"Preflight wording producers not independently reviewed."},
    {"id":"F03-8","status":"fixed","note":"NUL early-return removed; Git-binary changes scan staged blob bytes."},
    {"id":"F04-1","status":"fixed","note":"Binary blobs are scanned as lossy UTF-8; listed key-container extensions are refused. This is not general binary-secret recognition."},
    {"id":"F04-2","status":"not-checked","note":"Agy tool classification not independently reviewed."},
    {"id":"F04-3","status":"still-open","note":"Read-only or absent Claude init still permits warning-only drift; documented accepted boundary."},
    {"id":"F04-4","status":"not-checked","note":"Collab exclusions documented but implementation not independently verified."},
    {"id":"F04-5","status":"not-checked","note":"Scope validation outside this pass."},
    {"id":"F04-6","status":"still-open","note":"Partially addressed: shared lock and fresh checks added, but lock timeout/error returns None and callers still write without serialization."},
    {"id":"F04-7","status":"not-checked","note":"Current Grok purpose-dependent brief behavior not fully traced."},
    {"id":"F05-1","status":"not-checked","note":"Never-commit matching outside this pass."},
    {"id":"F05-2","status":"fixed","note":"Inspected binary staged-blob fallback and commit-message scan before side effects."},
    {"id":"F05-3","status":"not-checked","note":"Agy outcome and ignored-path interaction not independently reviewed."},
    {"id":"F05-4","status":"still-open","note":"Absent/read-only init still grants warning-only drift; accepted boundary. Unexpected init tools now remove the exemption."},
    {"id":"F05-5","status":"not-checked","note":"All-turn tool aggregation and parser behavior not independently reviewed."},
    {"id":"F05-6","status":"not-checked","note":"Re-seat reporting and exit behavior outside this pass."},
    {"id":"F05-7","status":"not-checked","note":"Endpoint concurrency scheduling outside this pass."},
    {"id":"F05-8","status":"not-checked","note":"Confirmed live-bridge predicate only; Windows process identity and child-liveness claims not fully checked."},
    {"id":"F05-9","status":"not-checked","note":"Retention runtime behavior outside this pass."},
    {"id":"F05-10","status":"not-checked","note":"Unreachable baseline blobs outside this pass."},
    {"id":"F10-1","status":"fixed","note":"Current final-turn block recomputes brief and bound-artifact hashes and updates all corresponding drift fields."},
    {"id":"F10-2","status":"still-open","note":"Intentional fail-closed boundary; current refusal explicitly says repair Git and that --allow-secret does not apply."},
    {"id":"F10-3","status":"not-checked","note":"Routing ledger rewrite outside this pass."},
    {"id":"F11-1","status":"not-checked","note":"Empty agy tool-name parser behavior outside this pass."},
    {"id":"F11-2","status":"not-checked","note":"Routing serialization/write error handling outside this pass."}
  ],
  "unproven": [
    "The two secret-gate fixes were verified by code inspection, not an executed failure-injection or regression test.",
    "Detached status convergence when lock acquisition times out or fails.",
    "Runtime detection of changes made during secondary turns; restored-to-identical-content writes are outside snapshot detection.",
    "Panel findings marked not-checked were not independently revalidated."
  ],
  "first_run_checklist": [
    "A staged ++-prefixed secret produces a path/kind refusal, nonzero exit, and unchanged HEAD without printing the secret.",
    "A failed per-file staged diff produces an unreadable-path refusal and unchanged HEAD.",
    "A clean finish prints the expected staged paths and a resulting commit identifier that matches HEAD.",
    "Concurrent detached status readers observe a live run without a death record, then a stable done status matching the background result.",
    "A secondary-turn brief or artifact mutation appears in the recorded drift fields before exit 0 is trusted."
  ]
}