{
  "schema_version": "1",
  "verdict": "ACCEPT",
  "verdict_reason": "F04-1 through F04-3 are fixed; the remaining historical Windows time-zone edge case is a nonblocking limitation of the normalization.",
  "reply_markdown": "**Q1.** The round-trip rule fixes F04-2’s Berlin boundaries and preserves genuine repeated-hour candidates when the UTC lookup is accurate. The new synthetic and production-Local tests address the previous coverage gap.\n\nThere is one historical counterexample: Windows Samoa rules around New Year 2012 can make the UTC lookup disagree with a valid local offset. The new normalization then invents a gap and selects an already-passed reset instead of tomorrow’s midnight (finding #1). I found no specific current or future instance, so this does not block the 2026 wave. Avoid claiming unrestricted historical-zone equivalence.\n\n**Q2.** I found no remaining pre-routing-state serialization in the requested paths. Ledger member records and `roster.skipped` now use routed states joined by position. Detached status starts from selected runners, receives execution-state updates, and `--status` renders that saved record. The timeout exceptions likewise follow selected seat order.\n\nThe new real fake-CLI test checks the required light reviewer in every member’s ledger entry and checks that `roster.skipped` is empty. It does not itself exercise detach/status or an unselected member, but the inspected paths use the correct sources. F04-3 is fixed. F04-1’s boundary-safe suffix check and direct classifier/scan fixtures also resolve the original panic.\n\n**Q3. ACCEPT** wave 1 into the compatibility track. Close F04-1, F04-2, and F04-3. The deferred telemetry, oracle, and shared-plan findings remain open and are outside this acceptance scope.\n\nThis is based on source review, the checked-in regressions, and the supplied run results. I did not rebuild or rerun the Rust suites. The Windows Local test can skip on other zones, so its explicit execution evidence matters more than the aggregate passing count.\n\n## Requested checks\n\n- **RC1:** CWD repository root; **workspace-write**; add a synthetic `ResetZone` reproducing Windows Samoa’s 2011/2012 local-year versus UTC-year lookup, then test `retry_after_in(\"try again at 12:00 AM\", \"2012-01-01T14:01:00+14:00\", zone)`. Require valid midnight to retain `+14:00` and the result to be `2012-01-02T00:00:00+14:00`, matching the pinned plugin (finding #1). Budget: one fixture, 15 minutes; follow-up, not an acceptance prerequisite.",
  "findings": [
    {
      "severity": "minor",
      "locations": [
        {
          "path": "crates/c3-core/src/health.rs",
          "line": 253
        },
        {
          "path": "crates/c3-core/src/health.rs",
          "line": 350
        }
      ],
      "claim": "The new normalization can discard a genuine historical Windows local offset when chrono's UTC lookup selects a different year's rules, causing a valid reset time to be treated as a gap.",
      "trigger": "Using Windows Samoa Standard Time with reference 2012-01-01T14:01:00+14:00, parse 'try again at 12:00 AM'. This requires a historical or simulated reference; no specific current or future trigger was established.",
      "evidence": [
        {
          "kind": "read-code",
          "reference": "crates/c3-core/src/health.rs: ResetZone::wall_offsets and wall_clock_candidates",
          "observation": "Normalization rejects an offset unless the UTC lookup returns it. If every candidate is rejected, the caller advances minute by minute until it finds a supposedly valid wall time."
        },
        {
          "kind": "read-code",
          "reference": "Locked chrono 0.4.45 cached source: src/offset/local/windows.rs",
          "observation": "The Windows UTC lookup selects time-zone rules using the UTC year, which can differ from the local year used to classify the original wall time."
        },
        {
          "kind": "ran-command",
          "reference": "Read-only Windows registry inspection of Samoa Standard Time/Dynamic DST and .NET TimeZoneInfo checks",
          "observation": "The 2011 record has Bias 660 and daylight bias -60; the 2012 record has Bias -780 and daylight bias -60. .NET classifies 2012-01-01 midnight as valid and unambiguous at +14:00."
        },
        {
          "kind": "ran-command",
          "reference": "In-memory invocation of AST-extracted ConvertTo-ZoneTime, Get-WallClockCandidates, and Select-TimeOnlyReset from pinned plugin v0.6.1",
          "observation": "The reference implementation returned 2012-01-02T00:00:00.0000000+14:00 for the trigger."
        },
        {
          "kind": "inferred",
          "reference": "New normalization combined with chrono's Windows year selection",
          "observation": "The genuine +14 midnight candidate maps to UTC in 2011 and is rejected against the -10 rules. The alternative -10 candidate maps into 2012 and is also rejected. The artificial gap ends at 14:00; the five-minute allowance accepts that already-passed instant at reference 14:01, yielding 2012-01-01T14:00:00+14:00 instead of tomorrow's midnight."
        }
      ],
      "verification": "Add a source-faithful synthetic Samoa year-boundary fixture and assert both the valid +14 midnight classification and the pinned plugin's next-midnight result.",
      "remedy": "Correct the Windows UTC lookup used as the normalization authority for cross-year rule changes, or explicitly bound the supported historical scope and retain the counterexample as a regression fixture; blindly retaining raw candidates would reintroduce F04-2.",
      "supersedes": []
    }
  ],
  "prior_findings": [
    {
      "id": "F02-1",
      "status": "still-open",
      "note": "Spool synchronization is unchanged in this range and remains assigned to wave 2."
    },
    {
      "id": "F02-2",
      "status": "still-open",
      "note": "Closed telemetry classifiers are unchanged and remain assigned to wave 2."
    },
    {
      "id": "F02-3",
      "status": "still-open",
      "note": "Failed-deletion retry identity is unchanged and remains assigned to wave 2."
    },
    {
      "id": "F02-4",
      "status": "still-open",
      "note": "The complete harness assertion coverage map and telemetry shim are not delivered by this range."
    },
    {
      "id": "F02-5",
      "status": "fixed",
      "note": "The state still correctly acknowledges the existing commit-before-spool ordering."
    },
    {
      "id": "F02-6",
      "status": "fixed",
      "note": "The previously reviewed anchor implementation is unchanged."
    },
    {
      "id": "F02-7",
      "status": "still-open",
      "note": "Shared plan infrastructure is assigned to wave 1b and is outside the reviewed range."
    },
    {
      "id": "F02-8",
      "status": "fixed",
      "note": "Decision P4 retains spawned Claude for parity and gates native Messages on its own benchmark."
    },
    {
      "id": "F04-1",
      "status": "fixed",
      "note": "str::get guards the suffix boundary before slicing; new fixtures cover Unicode names in the helper, classifier, and both scan variants."
    },
    {
      "id": "F04-2",
      "status": "fixed",
      "note": "The reported Berlin boundary errors are corrected and covered by synthetic, IANA, and conditional production-Local tests; the supplied report confirms the production test ran. Finding #1 records a distinct historical limitation."
    },
    {
      "id": "F04-3",
      "status": "fixed",
      "note": "Member and skipped records now use final routed states. The real fake-CLI integration test asserts correct state and empty skip records in every member's ledger entry."
    }
  ],
  "unproven": [
    "The reported 542 passing tests and harness results were not independently rerun during this read-only review.",
    "Detached-panel status and unselected-member serialization were traced in code but not exercised live.",
    "The historical Samoa C3 result is inferred from the changed code and locked chrono implementation; the pinned plugin result was executed in memory.",
    "The production Windows Local regression test conditionally skips outside the matching zone; general passing test totals do not establish that it ran on every machine."
  ],
  "first_run_checklist": []
}